text,label
فيني شوف سندوتشات برجر كينج,X X X X X
لو سمحت ابي اكنسل طلب ورفض يكنسله من التطبيق والموقع,X X X X X X X X X X
عايزة اغير العنوان المتسجل,X X X X
ابي اضيف رقم اخر,X X X X
مادري ليش اتاخر الاوردر,X X X X
ممكن توريني الطعام المفضل,X X X X
اذا بدك تحضرلي الحساب,X X X X
فيك تساعدي بشي بليز,X X X X
راح ارسلكن عنواني الجديد,X X X X
ممكن اخد الفاتورة,X X X
كنت عايزة احذف عنواني,X X X X
كان بدي زود الوجبة العائلية,X X X ItemName ItemName
حل قائمة الاوردرات السابقة,X X X X
ابي شوف منيو وجبات الاطفال بماكدونالدز,X X X X X X
من فضلك محتاج مساعدة,X X X X
كنت عايز اشوف اوردري المفضل,X X X X X
فيك تفرجيني الأكل يلي طلبتوا من قبل,X X X X X X X
عايزة احط عنوان بيتي,X X X X
بدياك تفرجينى الشيك,X X X
شحال الشيك,X X
عايز ادفع الحساب,X X X
بليز غيرلى رقم الهاتف الخلوى ل 1535286852,X X X X X X phone
اتوق لرؤيه قائمه الفطار فى ماكدونالدز,X X X MenuName X X
لو سمحت عايز اغير بياناتي,X X X X X
ممكن تقولي الاوردر من الاول,X X X X X
فيك تضيفلي بيتزا تشيكن رانش,X X ItemName ItemName ItemName
انا بدي ممثل خدمة عملا,X X X X X
قداي بياخد وقت,X X X
اذا فيك تعرض لي طعامي المفضل,X X X X X X
ممكن اتواصل مع حد من خدمة العملاء,X X X X X X X
غيرت رقم جوالي,X X X
هيوصلي امتى الطلبات,X X X
عايز اعرف معاد الاوردر لو سمحت,X X X X X X
ممكن اتكلم مع واحد من خدمة العملاء,X X X X X X X
ابى اتحدث بالانقليزية,X X Language
اعرضلي الاوردرات المعتادة,X X X
الاكل لسة ماجاش,X X X
شنو يعني هالكلمه بالانقليزي,X X X Language
عايز بيتزا خضروات كبيرة,X ItemName ItemName ItemSize
فيني غير اللغة,X X X
خاطر ع بالى النظر لقائمه الطعام حق كنتاكى,X X X X X X X X
وينو الحساب حقي,X X X
انا عايز اسال على حاجة,X X X X X
خبرونى كيف ممكن اتتبع الطلب رقم 900,X X X X X X OrderNumber
ودى أعرف شغلات معينه,X X X X
داير ببالى تبديل اللغه اللى اللغه العربيه,X X X X X X Language
ممكن اشوف منيو وجبات الأطفال بماكدونالدز لو سمحت,X X X X X X X X
بلغني تمن الاكل من فضلك,X X X X X
حابب اشوف اوردراتي السابقة,X X X X
عايز اشوف الأكل الي طلبتوا قبل كدا,X X X X X X X
خاطر فى بالى القى نظره ع الاوردرات المستحبه,X X X X X X X X
اعرضلي الاكل الي طلبته قبل كدا,X X X X X X
ابي انظر على المنيو,X X X X
ممكن اعمل تعديل في عنوان البيت,X X X X X X
ابغاك تطلبلي وجبة السوبر ستار,X X ItemName ItemName ItemName
فيني ارجع لقائمة تحديث البيانات,X X X X X
هاتلي منيو السلطات لو سمحت,X X MenuName X X
خليني شوف المنيو بليز,X X X X
العنوان الجديد تبعي,X X X
شسوى,X
راح اطلبها صغيرة,X X ItemSize
فيك تنقلني لممثل خدمة عملا بليز,X X X X X X
151612 فاضل عليه قد ايه,OrderNumber X X X X
بدي شي,X X
ممكن اشوف الطلبات بتاعتي تاني,X X X X X
انا عايز اعرف الاوردر بيوصل في خلال قد ايه,X X X X X X X X X
لك وينو الاوردر تبعي,X X X X
احب نتفرج على مكان الاوردر تويكا,X X X X X X
عايز احول لغة التواصل الى انجليزية,X X X X X Language
عايز قائمة تغيير البيانات,X X X X
هاي بوط,X X
ممكن استبعد العنوان القديم,X X X X
هيدا عنوان منزلي,X X X
شنو موجود بالسلطات,X X MenuName
ابي شوف الي موجود,X X X X
ابغى اسوي اوردر,X X X
هسجل عنواني,X X
لنا ساعة ونص طالبين ولسا الطلب ماوصل,X X X X X X X
يا ليت تحدثني بالعربية,X X X Language
شو بدي سوي الحين,X X X X
امتى راح توصل الطلبات,X X X X
فيني امسح وجبة التوفير,X X ItemName ItemName
نقلب على شيء,X X X
ممكن تعرضلي منيو الوجبات الرئيسية في سبكترا,X X X X X X X
ممكن اشوف منيو السندوتشات في برجر كينج,X X X X X X X
اريد متابعة الاوردر,X X X
ارز,ItemName
اريد وضع هذا 987489334 الرقم مكان الرقم الاخر,X X X phone X X X X
اديني الحساب لو سمحت,X X X X
هاخد باستا فراخ كرسبي مع جبنة سايحة,X ItemName ItemName ItemName Include Topping_Include Topping_Include
فرجيني المنيو,X X
من فضلك بدل لى اللغه للانكليزيه,X X X X X Language
الفاتوره كام اسا,X X X
بدي الغي عنواني يا خيي,X X X X X
اعرضلي الاوردر بتاعي المفضل,X X X X
فيني شوف طعامي المفضل,X X X X
وشنهى الى خلا الاوردر رقم 76510 ما ايجا لحد الان,X X X X X OrderNumber X X X X
اهلآ بيك,X X
عايزة 3 بيتزا بيبروني حجم صغير,X itemnumber ItemName ItemName X ItemSize
اذا فيك تفرجيني الكارت,X X X X
راح اطلب الحجم المتوسط,X X X ItemSize
ابا احذف العنوان,X X X
ابي ضيف عنوان البيت يا اخي,X X X X X X
طلب,X
رجعني للقائمة الرئيسية,X X X
ابغى اعرف كم الفاتورة,X X X X
عايزها كبيرة,X ItemSize
ايمت بيوصل الاكل,X X X
شنو هاد احكي معي عربي يا خيي,X X X X Language X X
كنت عايزة اتواصل باللغة الفرنسية,X X X X Language
عايزة اتابع معاك الاوردر أول بأول,X X X X X X
عايز اضيف عنواني,X X X
دخل عنوان البيت من فضلك,X X X X X
ابي اسال شي,X X X
ممكن اعرف اسجل بياناتي ازاي,X X X X X
فيني اتواصل مع حدا من خدمة العملاء,X X X X X X X
اذهب الى قائمة تغيير البيانات,X X X X X
شحال الحساب,X X
فيني زودكوا بعنوان البيت,X X X X
بدي اطلب 2 بيتزا وسط,X X itemnumber ItemName ItemName
وريني قائمة الطلبات,X X X
هبعتلك رقمي الجديد عشان تعمله تحديث,X X X X X X
بدياها حجم كبير,X X ItemSize
صار لي ساعه طالبه وللحين الطلب ما انرسل للمطعم,X X X X X X X X X
رقم 1,X X
ممكن اغير اللغة,X X X
فيك تغيرلي رقم موبايلي الى 01147753268,X X X X X phone
خليني الغي العنوان,X X X
فيك تعطيني الشيك,X X X
عايز 4 بافلو تشيكن فرايز من فضلك,X itemnumber ItemName ItemName ItemName X X
ممكن اراجع على الاوردر من الاول,X X X X X X
ماشروم صوص,ItemName ItemName
بعد اذنك عايزة حجمهم كبار,X X X X ItemSize
فيني شوف قائمة السندوتشات بليز,X X X MenuName X
لو سمحت ممكن غيرلي الرقم المتسجل عندكوا في السيستم للرقم ده 0121111111,X X X X X X X X X X X phone
حابب اسأل عن اشيا,X X X X
وريني الاوردرات السابقة,X X X
عايز اشيل عنواني,X X X
اسجل عنواني لو سمحت,X X X X
لدي استفسار بشي,X X X
هيدا الاوردر 3655364 اذا بتريد,X X OrderNumber X X
هاطلب 2 بيض اومليت و زود فلفل,X itemnumber ItemName ItemName X Include Topping_Include
عندي استفسار,X X
احط عنوان البيت ازاي,X X X X
ممكن اغير رقم تليفوني,X X X X
فيني شوف منيو السمك,X X X MenuName
حياك,X
فيني راجع على الاشيا يلي طلبتها,X X X X X X
بدي الاختيار الرابع,Include X X
الحين,X
فيك تحكي معي انجليزي,X X X Language
نستنى في الاوردر,X X X
عايز اتابع معاك الأوردر أول بأول,X X X X X X
كنت عايز اغير رقم موبايلي المسجل,X X X X X X
حابة اسأل على حاجة,X X X X
بدي انتقل للمرحلة التالية,X X X X
بدي ضيف عنوان يا اخي,X X X X X
ايه المرحلة الي جاية,X X X X
داير شوف منيو البيتزا,X X X MenuName
ممكن انتقل لعملية الحساب,X X X X
داير شوف الكارت,X X X
اعرضلي طلباتي المفضلة,X X X
عايز 2 بيتزا مارجريتا حجم متوسط,X itemnumber ItemName ItemName X ItemSize
وجبة كبيرة,X ItemSize
عايزة فراخ بروستد كومبو,X ItemName ItemName X
بدي اتكلم مع حدا,X X X X
ممكن تعطيني الطلبات السابقة,X X X X
بدي ضيف عنوان البيت,X X X X
عايزة اخد بيتزا خضروات حجم كبير,X X ItemName ItemName X ItemSize
عنوانى اريد تغييره,X X X
اتحدث عربي يا اخي,X Language X X
بدي 3 اطباق مكرونة اذا بتريد,X itemnumber ItemName ItemName X X
خطواط تسجيل العنوان,X X X
اريد ان اقيد عنواني,X X X X
ممكن استرجع الاوردرات السابقة,X X X X
ايه المنيو النهاردة,X X X
ابغا اشوف حسابك منفضلك,X X X X
اقدر اتابع الاوردر,X X X
الشيك اذا بتريد,X X X
هيدا محل الاقامة الجديد,X X X X
شو بعد هيك,X X X
ابغى اطلع على اشيائى المضله,X X X X X
ممكن اطلب 2 بيبيروني بيتزا منغير بصل مع بيبسي,X X itemnumber ItemName ItemName Exclude Topping_Exclude Include Topping_Include
داير فى خاطرى اتكلم مع شى شخص,X X X X X X X
فيني شوف المنيو اذا بتريد,X X X X X
خذني لقائمة تغيير البيانات لو سمحت,X X X X X X
ممكن اروح على القائمة الرئيسية,X X X X X
سوف اقوم بتبديل رقم الهاتف,X X X X X
قدم لي الوجبة المفضلة من فضلك,X X X X X X
كنت عايزة اسأل عن حاجة,X X X X X
بدي اسألك بشي شغلة,X X X X
امتى هيوصل الأوردر من فضلك,X X X X X
ممكن اطلب حاجة,X X X
من فضلك عايز وجبة ماك راب,X X X ItemName ItemName ItemName
فيك تغير لي عنواني المسجل,X X X X X
ابي ضيف عنوان البيت,X X X X
يس,X
الاوردر مجاش لحد دلوقتى ايه المشكله,X X X X X X
فاضل قد ايه على الطلبات,X X X X X
ابغى عدل عنوان البيت,X X X X
عايزة ارجع للقائمة الرئيسية,X X X X
ابي حدث العنوان حجي,X X X X
عاوز اعرف الاوردر بيوصل في قد ايه,X X X X X X X
لو سمحت عايزهم حجم وسط,X X X X ItemSize
هاخد مكرونة عليها بروكلي,X ItemName Include Topping_Include
اذا فيك تفرجيني اوردري المفضل,X X X X X
ابغى اسوي تعديل بالعنوان حجي,X X X X X
انا بدي انتقل للمرحلة التالية,X X X X X
طلب رقم 15614 فاضله قد ايه,X X OrderNumber X X X
ابعتلي الطلبات السابقة,X X X
محتاجة اسأل على حاجة,X X X X
مازلت ناطر الاوردر,X X X
حابب اتحدث انجليزي,X X Language
من فضلك حدثلى رقم الهاتف الخلوى للرقم 9775759854,X X X X X X X phone
الساعه كام,X X
بدي تابع باللغة الانجليزية اذا بتريد,X X X Language X X
ما هي خطواط اضافة عنوان المنزل,X X X X X X
كيف ما اصبحت,X X X
بغيت اضيف جوال جديد,X X X X
خليني انتقل لقائمة تغيير البيانات,X X X X X
ماعليش نسقسيك,X X
حلقات بصل مقلية مع شيدر صوص لو سمحت,ItemName ItemName ItemName Include Topping_Include Topping_Include X X
كيف احل المشكله,X X X
قديش فاضل وقت على الاوردر,X X X X X
ابعتلي قائمة الطعام المفضل,X X X X
حياك الله,X X
عاوز اشوف البيتزا الموجودة,X X MenuName X
داير اختار اللغة الانجليزية,X X X Language
بس بدي عدل العنون بليز,X X X X X
ابا شوف المنيو,X X X
فرجيني اوردري المفضل,X X X
ابغى اشوف الطلبات السابقى حقي,X X X X X
بدي اتحدث مع ممثل خدمة عملاء اذا بتريد,X X X X X X X X
لدي عنوان يديد,X X X
غيرلى رقم الهاتف الجوال ل 0154328655,X X X X X phone
عايز فطيرة مكس جبن,X ItemName ItemName ItemName
عايز ارجع للقائمة الرئيسية,X X X X
صار لي ساعه طالبه وللحين الطلب ما انرسل,X X X X X X X X
عطيني المفضلة من فضلك,X X X X
سوف اقوم بتبديل رقم المحمول,X X X X X
عايز اشيل عنوان بيتي,X X X X
داير ع بالى اشوف اكلى المفضل,X X X X X X
من فضلك بدى وجبه تويست اكستريم ميل,X X X ItemName ItemName ItemName X
امتى هستلم الأوردر,X X X
بدي سوي اوردر و ماني عارفة,X X X X X X
خبرني شو موجود بمنيو الشوربة من فضلك,X X X X MenuName X X
فيك ترجعني للمنيو الرئيسي,X X X X
وقتاش بيوصل الأكل,X X X
فيك تغيرلي اللغة انجلش,X X X Language
2 ساندوتش لحمة صاج وزود تومية,itemnumber ItemName ItemName ItemSize Include Topping_Include
لو سمحت ينفع اضيف رقم ارضي,X X X X X X
بلكي غير عنواني,X X X
ايش عندكوا من حلويات,X X X MenuName
ابغى بدل العنوان,X X X
الحساب كام لو سمحت,X X X X
ممكن استفسر عن حاجة,X X X X
مش عارفة اعمل اوردر ازاي,X X X X X
اعرضلي قائمة تغيير البيانات,X X X X
عايز اطلب وجبة الجراند تشيكن,X X ItemName ItemName ItemName
ابا غير رقم الجوال,X X X X
اقدر اضيف العنوان,X X X
انا عاوز اشوف المنيو,X X X X
ممكن تطلعنى على قوائم مطعم حسنى,X X X X X X
فيك تورينى حسابى,X X X
ازاي بعمل الاوردر من فضلك,X X X X X
اعرض لي القائمة الرئيسية,X X X X
ابغى اشوف الطلبات المفضلة حقي,X X X X X
شو يلي جاي,X X X
اذا بتريد بدي مساعدة,X X X X
دلوقتي لو عايزة اضيف رقم موبايل اعمل ايه,X X X X X X X X
يعطيك العافية شنهو طريقة تغيير الجوال,X X X X X X
عايزة ابدل رقم تليقوني,X X X X
عايز اغير لغة التواصل,X X X X
كيف بسوي اوردر من فضلك,X X X X X
فيك تخبرني قديش باقي من الوقت تايوصل الأوردر,X X X X X X X X
بس بليز فيك تفرجيني المنيو,X X X X X
ابغى غير اللغة من فضلك,X X X X X
ابغى مساعدة,X X
شنو اهو ملخص الاوردر حقي,X X X X X
فيني اسألك عا شي,X X X X
سويلي حذف لهذا الرقم 65454454,X X X X phone
من فضلك ضيف واحدة هابي ميل,X X X X ItemName ItemName
عندكن شاورما,X ItemName
خليني اذهب الى قائمة تغيير البيانات,X X X X X X
وقتاش بيوصل الطلب,X X X
من فضلك عايز 2 هامبرجر مع سلطة خضراء,X X X itemnumber ItemName Include Topping_Include Topping_Include
فيني شوف المنيو اذا بتريد,X X X X X
شكو ماكو,X X
اقدر الغي وجبة الدويتو,X X ItemName ItemName
راح اطلب 2 فرخة مشوية,X X itemnumber ItemName ItemName
العاشر,X
فيكم تخبرونى هلا وينه اوردى رقم 30584,X X X X X X OrderNumber
عايزة الأكل الي طلبته قبل كدا,X X X X X X
بلغني بالحساب من فضلك,X X X X
بلكى بتغيرلى رقم الجوال حقى للرقم 01254215876,X X X X X X phone
بدي امسح محل الاقامة اذا بتريد,X X X X X X
وينه الاوردر 3058 الحين,X X OrderNumber X
حصلتلي مشكلة,X X
حطلي كمان 3 باكت بطاطس عليها كاتشب و مايونيز,X X itemnumber ItemName ItemName Include Topping_Include X X
لو سمحت تجاوب على سؤالي,X X X X X
منغير طماطم,Exclude Topping_Exclude
يعطيك العافية فيك تغيرلي رقم السيلولير,X X X X X X
ابعتلي منيو الوجبات العائلية في بيتزا هت,X X X X X X X
فيك تفرجيني المنيو بليز,X X X X
ابي ضيف العنوان دابا,X X X X
عايز اضيف فرخة مشوية من دون لمون,X X ItemName ItemName Exclude Exclude Topping_Exclude
لك قديش بياخد وقت,X X X X
ممكن الحساب دلوقتي,X X X
ممكن احذف العنوان لو سمحت,X X X X X
ممكن امسح العنوان,X X X
عايز انتقل للخطوة التالية لو سمحت,X X X X X X
عايز ازود وجبة ميجا ماك,X X ItemName ItemName ItemName
ممكن تعرفنى ازاى اغير رقم الفون القديم للرقم 01528476354,X X X X X X X X phone
وريني الطعام الي موجود,X X X X
عاوز اشوف الاوردرات القديمة,X X X X
بدي مساعدة بليز,X X X
خليني اتكلم مع حد من خدمة العملاء,X X X X X X X
فينا ننتقل للخطوة التالية,X X X X
عايز اشوف قائمه مطعم ألبان سويسرا,X X X X X X
زودني بالكارت حقي,X X X
طلبت من عندكم وابي الغي الطلب شلون,X X X X X X X
سكر الاوردر من فضلك,X X X X
عايزة اوردر 3 ساندوتشات شاورما وسط,X X itemnumber ItemName ItemName ItemSize
ابي الغي الطلب شلون,X X X X
عايزك تغيرلى اللغه,X X X
ممكن توريني منيو الفطار بتاع ماك,X X X X X X
عايز اتنقل للخطوة التالية,X X X X
امى عملالى ايه غدا النهارده,X X X X X
راح ضيف الوجبة العائلية,X X ItemName ItemName
ارغب في التحدث بالانجليزية,X X X Language
بدياك تفرجيني اوردراتي يلي طلبتها من قبل اذا بتريد,X X X X X X X X X
بلكي استفسر عن شي شغلة,X X X X X
وش سوي الان,X X X
ممكن اشوف المنيو,X X X
ابي ممثل خدمة عملا يا خيي,X X X X X X
بدي احاسب الحين,X X X
هاي بوت,X X
زودني بقائمة الطلبات السابقة,X X X X
ابغى ضيف بلاصة,X X X
حابب ابدل اللغه الى العربيه,X X X X Language
عايز الحساب,X X
وصل لوين الاوردر,X X X
فيك تفرجيني القائمة الرئيسية,X X X X
ممكن تراجع الطلبات,X X X
ابي اعرف كيف بسوي الاوردر,X X X X X
بدياه كبير,X ItemSize
فيني ضيف وجبة الماك دينار,X X ItemName ItemName ItemName
عايز اراجع على الاوردر من فضلك,X X X X X X
عاوز اشوف الاكل المعتاد,X X X X
داير شوف الطلبات مرة اخرى,X X X X X
عايزة اغير بياناتي المتسجلة,X X X X
الشيك حداي,X X
داير اعرف كيف بطلب هاي الاوردر,X X X X X X
اديني الحساب من فضلك,X X X X
كبيرة,ItemSize
داير شوف الطلبات السابقة,X X X X
عندي مشكلة في طلب الاوردر,X X X X X
متقولى ازاى اتكلم مع الخدمه,X X X X X
اعرض لي كدا كل الي طلبته,X X X X X X
بدي أكل,X X
هيوصل امتى الاوردر ده 47525,X X X X OrderNumber
كنت عايز اغير لغة التواصل,X X X X X
خلينا نتولصل باللغة الاسبانية,X X X Language
يلي بعد هيك,X X X
اذا بتريد تفرجيني الاشيا يلي طلبتها,X X X X X X
راح ضيف وجبة ليتل تيستي,X X ItemName ItemName ItemName
اريد ان اطلع على الكارت,X X X X X
حضرتك ازاي اغير رقم الموبايل,X X X X X
عايز اشوف طلباتي السابقة,X X X X
فرجيني منيو المشويات اذا بتريد,X X X X X
شوصارلك,X
اعرض لي الاكل الي بطلبوا دايمآ,X X X X X X
ممكن تزودلي وجبة الجراند تشيكن,X X ItemName ItemName ItemName
هاكل 2 برجر,X itemnumber ItemName
شو فينو الاوردر يا عمي,X X X X X
من فضلك ايه طريقة تغيير الموبايل,X X X X X X
هلأ بدي اتتبع الاوردر,X X X X
ممكن اضيف عنواني الجديد,X X X X
حولى اللغه بعد اذنك,X X X X
كنت عايز احط عنواني,X X X X
رز وفراخ مندي بالصوص الحار من فضلك,ItemName ItemName ItemName Topping_Include Topping_Include X X
ما جاني الاوردر,X X X
لو سمحت تعرض لي منيو الأطباق الرئيسية في ستيك اوت,X X X X X X X X X X
سويلي وجبة الجراند تشيكن اذا بتريد,X ItemName ItemName ItemName X X
عايزة اشوف طلبي المعتاد من فضلك,X X X X X X
لو سمحت اعرضلى الحاجات اللى انا طالبها من,X X X X X X X X
عايز اشوف منيو الفطار فى سانتوس,X X X X X X
عايز احذف وجبة الميجا ماك,X X ItemName ItemName ItemName
ايش اللى ما عم يظبط معى,X X X X X X
عايز اعرف الاوردر فاضله اد ايه,X X X X X X
هختار اللغة العربية,X X Language
ابغى اسوي تعديل بالعنوان حقي,X X X X X
فينى اعطيك عنواني الجديد,X X X X
اذا فيك تعرضلي الكارت تبعي,X X X X X
كان بدي اسأل عا شي,X X X X X
غل,X
خليني اغير عنواني المسجل,X X X X
بدياك تفرجينى الحساب,X X X
اذهب لقائمة تعديل البيانات,X X X X
ممكن اراجع الاوردر معاك,X X X X
صوص الجبنة,ItemName ItemName
ابي ضيف الوجبىة العائلية,X X ItemName ItemName
ابي اللغة العربية,X X Language
بدي شوف منيو وجبات الاطفال بماكدونالدز اذا بتريد,X X X X X X X X
هل بامكاني حذف وجبة التشيكن ستربس,X X X ItemName ItemName ItemName
خاطر ب بالى ابص على اكلى المتميز,X X X X X X X
وريني قائمة البيتزا,X X MenuName
بدياك تراجعلي عالطلبات بليز,X X X X
فيك تلغيلي وجبة الغداء من الوجبات المحددة من قبل,X X ItemName ItemName X X X X X
اعرضلي طعامي المفضل,X X X
لو سمحت لو عايزة اغير نمرتي للنمرة دي 05049144444 ازاي,X X X X X X X X phone X
ممكن اعمل تعديل في عنوان بيتي,X X X X X X
ابى اغير رقم تليفوني,X X X X
ابغا اشوف حسابى من فضلك,X X X X X
عايزة ابدل عنوان البيت,X X X X
عايزة طبق جانبي من البطاطس المحمرة معاها شيدر صوص,X X X X ItemName ItemName Include Topping_Include Topping_Include
بدي اتطلع عالأكل يلي طلبتوا من قبل,X X X X X X X
ممكن الحساب,X X
كده الحساب كام من فضلك,X X X X X
داير اطلب نفر مثلوثة كبسة لحم,X X itemnumber ItemName ItemName ItemName
عم روح عالخطوة التالية,X X X X
هاتلي الفاتورة,X X
بدياك تراجعلي عالأوردر بليز,X X X X
بدي 3 ستيك هاوس برجر,X itemnumber PredefinedMealName PredefinedMealName PredefinedMealName
من فضلك 3 شاورما ساندوتش و شيل التومية,X X itemnumber ItemName ItemName X Exclude Topping_Exclude
اعرضلي الاوردر من الاول لو سمحت,X X X X X X
بدى منك تفرجينى منيو زاد الخير,X X X X X X
ممكن اعيد اضافة رقم الموبايل,X X X X X
بغيت الحساب,X X
مادابيك واحدة الفريدو باستا بالمشروم صوص,X itemnumber ItemName ItemName Topping_Exclude Topping_Exclude
امسح عنوان البيت,X X X
عايزة منيو السلطات اليومي بتاعكوا,X X X X X
زودلي وجبة جراند تشيكن مع الاوردر,X PredefinedMealName PredefinedMealName PredefinedMealName X X
ممكن تعطيني المنيو,X X X
هاخد 3 بيتزا سوبر سوبريم مع بطاطس ويدجز,X itemnumber ItemName ItemName ItemName Include Topping_Include Topping_Include
مساء النور,X X
احضرلي طبق مكرونة مع الصوص الابيض,X ItemName ItemName Include Topping_Include Topping_Include
فيني ارجع للقائمة الرئيسية,X X X X
بدي غير رقم الجوال تبعي 01002013337,X X X X X phone
