text,label
عايز ساندوتش بيف برجر,X ItemName ItemName ItemName
عايز 3 اطباق سلطة كبار مع طبق بطاطس محمرة,X itemnumber ItemName ItemName ItemSize Include Topping_Include Topping_Include Topping_Include
عندي مشكله ان اذا الرسائل التأكيد للجوال ماتوصل ايش السبب,X X X X X X X X X X
الحين لو بغيت اعدل رقم جوالي شسوي,X X X X X X X
متوسط,ItemSize
فيك تسويلي تعديل لارقامي المسجلة عندكون,X X X X X X
الاوردر فاضل عليه اد ايه,X X X X X
عايزة منيو فطار ماكدونالدز,X X X X
اوردر رقم 2512 هيوصل في قد ايه,X X OrderNumber X X X X
عايز اراجع عالأوردر من فضلك,X X X X X
عايز اتواصل مع خدمة العملاء,X X X X X
فيك تعدل لي عنوان البيت,X X X X X
بدي الحساب الحين,X X X
ابي الاختيار الثالث,Include X X
بغيت استفسر عن اشيا,X X X X
اقدر اشوف الي طلبته قبل كدا,X X X X X X
من فضلك,X X
عدلى رقم الهاتف الخلوى حقى للرقم 012554576,X X X X X X phone
عايز احدث عنواني,X X X
عطني قائمه الشاورما,X X ItemName
شو يلي بعد هادي المرحلة ظ,X X X X X X
وجبة بيج ماك لارج معاها 2 بيبسي كان,PredefinedMealName PredefinedMealName PredefinedMealName ItemSize Include itemnumber ItemName X
هزود وجبة الجراند تشيكن,X ItemName ItemName ItemName
عايز اعمل update للرقم لو سمحت,X X X X X X
من فضلك تابعلي الطلبات,X X X X
فيني اعطيك العنوان الجديد,X X X X
من فضلك تغير رقم موبايلي الى 01552687474,X X X X X X phone
بدي امسح الوجبة العائلية,X X ItemName ItemName
وينو الحساب,X X
كنت عايز قائمة تعديل البيانات من فضلك,X X X X X X X
حبيبي في مجال عدل الرقم,X X X X X
ابغى راجع الاوردر حجي,X X X X
انتهت الخطوة الحالية,X X X
ابعتلي الفاتورة على الرقم ده 01002378995,X X X X X phone
بلكي اتحدث مع ممثل خدمة عملاء,X X X X X X
بدي غير رقم هاتفي,X X X X
عايزة اغير بياناتي المسجلة,X X X X
عايز ابدل عنواني,X X X
محتاجة اشوف الاوردر مرة تانية,X X X X X
عايز اسجل عنوان سكني,X X X X
احتاج الى تبديل رقم الهاتف,X X X X X
فيك تخلينى اذا سمحت اتتبع الاوردر,X X X X X X
ابغى 3 ساندوتش هامبرجر كبير,X itemnumber ItemName ItemName ItemSize
فيك تفرجيني الباستا يلي موجودة بليز,X X MenuName X X X
شنو بعد,X X
هاخد 2 كوردن بلو,X itemnumber PredefinedMealName PredefinedMealName
ابغي غير بيانات حجي,X X X X
بيانات العنوان,X X
ابغا اشوف اشيائى المفضله,X X X X
عاوز خدمة عملاء,X X X
عايز اعرف ايه الأكل الي موجود,X X X X X X
اهو 2 بيتزا,X itemnumber ItemName
ابغى بدل رقم جوالي,X X X X
اقدر احاسب دلوقتي,X X X
هل بامكاني تغيير اللغة الى عربية,X X X X X Language
هادخل عنواني الحين,X X X
اتمنى منك اذا سمحت معرفه السبب فى تاخر الاوردر بتاعى,X X X X X X X X X X
سجللي عنوان بيتي,X X X
الطلبات هتوصل امتى,X X X
من فضلك احذف وجبة البيج ماك,X X X ItemName ItemName ItemName
كنت عايز اسجل عنوان البيت,X X X X X
ممكن اسألك سؤال,X X X
ابغى اتواصل مع ممثل خدمة عملا,X X X X X X
عايز اعرف ايه امشكله,X X X X
عايزة اغير رقم موبايلي,X X X X
فين الشيك,X X
ارغب في التحدث الى ممثل خدمة عملاء,X X X X X X X
قولي الاوردر وصل لفين,X X X X
راح اجولك شو صاير معي,X X X X X
من فضلك عايز ارجع للقائمة الرئيسية,X X X X X X
فيك تزودني بالشيك,X X X
قدم لي المنيو من فضلك,X X X X X
اذا فيك تراجعلي على الاوردر,X X X X X
عايزة اشيك على الاوردر,X X X X
وريني قائمة البيتزا,X X MenuName
الاوردر هيوصل في خلال قد ايه بعد اذنك,X X X X X X X X
زود الاختيار التاني,Include X X
مش عارف اعمل الاوردر ازاي,X X X X X
الاوردر هيوصل الساعة كام بالضبط,X X X X X
فرجيني قائمة الطعام اذا بتريد,X X X X X
اتمنى منك تخلينى اتتبع الطلب,X X X X X
هلأ بدي اطلب الجراند تشيكن ميل زيادة مايونيز,X X X PredefinedMealName PredefinedMealName PredefinedMealName Include Topping_Include
اعرضلي اوردر بتاعي المفضل,X X X X
شو الخطوة التالية,X X X
هل لديكوا شاورما,X X ItemName
ابي سجل عنوان البيت,X X X X
كنت عايزة اسجل عنوان المنزل,X X X X X
ابي اسوي اوردر,X X X
اطلب الاوردر ازاي لو سمحت,X X X X X
عايز احط عنواني,X X X
سمو شي,X X
بدي سوي تغيير برقم الموبايل تبعي,X X X X X X
هختار الالفريدو باستا,Include Topping_Include Topping_Include
احذفلي النمره دي 010000000,X X X phone
شو يلي بعد هيك,X X X X
بدي غير هدي اللغة,X X X X
شو عندكن بالسلطات,X X MenuName
اذا فيك تروح للقائمة الرئيسية,X X X X X
اعرضلي المقبلات الي في ستيك اوت,X X X X X X
اتكلم العربية,X Language
تلاتة بيج كينج ميل,itemnumber PredefinedMealName PredefinedMealName PredefinedMealName
خلاص بدي ضيف العنوان,X X X X
هاخد 2 سوبر سوبريم بيتزا و زودلي زتون,X itemnumber ItemName ItemName ItemName X Include Topping_Include
بدي طلب اذا بتريد,X X X X
عايز حساب الاكل يتبعتلي على الرقم ده 01149962375,X X X X X X X phone
ابا شوف طعامي المفضل,X X X X
فيني انتقل للمرحلة التالية,X X X X
الطلبات صارلها زمن ما بتوصل,X X X X X
بدي اتحدث مع انسان من بعد اذنك,X X X X X X X
ابغى احذف وجبة الدويتو,X X ItemName ItemName
ابغى واحد تشيكن تندر لارج,X itemnumber PredefinedMealName PredefinedMealName ItemSize
عايز احدث عنواني,X X X
فيني بدل العنوان بواحد جديد,X X X X X
كان بدي الغي العنوان,X X X X
عايزة احاسب,X X
بدي غير رقم الموبايل تبعي,X X X X X
الاوردر وصل لوين,X X X
عايز اشوف اوردراتي المسجلة,X X X X
غيرلى رقم فونى القديم للرقم دا 1205412065,X X X X X X phone
ابغى اسوي اوردر بيتزا بيبروني وسط,X X X ItemName ItemName ItemSize
ابي ارجع للقائمة الرئيسية,X X X X
عايزة اشوف الاوردرات المفضلة,X X X X
انا عايز اشوف المنيو,X X X X
اعرض لي المنيو الاساسي من فضلك,X X X X X X
عايزة احدث العنوان,X X X
عايزة اشوف طلباتي السابقة,X X X X
عايز انهي الاوردر,X X X
بغيت بنادم اتكلم معاه,X X X X
خليني اتكلم مع شخص,X X X X
عايز اشوف الاوردرات الي بطلبها باستمرار,X X X X X X
عاوز ارجع للقائمة الرئيسية لو سمحت,X X X X X X
هاي وجبة التوفير بدي الغيها,X ItemName ItemName X X
حابب اشوف المنيو المستحب لدى,X X X X X
هلأ اذا بدي غير رقمي شو بدي اعمول,X X X X X X X X
سوف اقوم بتغيير رقم الهاتف,X X X X X
حابة اسأل على حاجة,X X X X
داير على بالى التناقش مع اى بنادم,X X X X X X X
فيني الغي العنوان تبعي اذا بتريد,X X X X X X
ابي الأكل يلي طلبتوا من جبل,X X X X X X
ممكن اضيف عنوان المنزل,X X X X
هاتلي 5 شاورما لحمة كبير منغير كاتشب,X itemnumber ItemName ItemName ItemSize Exclude Topping_Exclude
ممكن تمسح وجبة الميجا,X X ItemName ItemName
ابغى عصيدة يا خيي,X ItemName X X
اريدك ان ترسل لي الأطباق الرئيسية بمطعم ستيك أوت,X X X X X X X X X
زودني بالطلبات السابقة حقي,X X X X
ممكن اسأل على حاجات,X X X X
ابا بدل رقم الجوال,X X X X
حولني بمنيو الفطار بتاع ماكدونادز,X X X X X
بدي سجل عنوان البيت تبعي,X X X X X
طلعلى اخر حاجه طلبتها,X X X X
عايز اشوف اخر اوردر طلبته,X X X X X
ضيف على الاوردر 3 بيوريه جزر,X X X itemnumber ItemName ItemName
ممكن تبعتلي الحساب عالرقم ده 01157899634,X X X X X phone
عايز بيتزا خضروات كبيرة,X ItemName ItemName ItemSize
عايز احذف عنوان بيتي,X X X X
عايز ارجع لقائمة تغيير البيانات,X X X X X
عايز حجمه كبير من فضلك,X X ItemSize X X
خليني اتابع الأوردر وصل لحد فين,X X X X X X
بدي اعرف متى بتجي ساعات الدوام,X X X X X X
ابعتلي الكارت,X X
عايز اعدل رقم تليفوني,X X X X
داير بخاطرى تحويل اللغه الى اللغه الانكليزيه,X X X X X X Language
فيك تاخدني لقائمة تغيير البيانات,X X X X X
حولني بخدمة العملاء,X X X
وقتاش بسوي الاوردر,X X X
الغي وجبة الجراند تشيكن,X ItemName ItemName ItemName
ابي الحجم الوسط,X X ItemSize
عايز اغير رقم تليفوني 01137462288,X X X X phone
سادة,X
ابغى القى نظرة عالأكل,X X X X
عنواني,X
رايد منكو لو سمحت تراجعولى الاشياء اللى انا طالبها,X X X X X X X X X
عايز اخلص الأوردر,X X X
داير عخاطرى اغير عنوان البيت حقى,X X X X X X
بدون جبنة,Exclude Topping_Exclude
اذا فيك تبعتلي الاكل المفضل بتاعي,X X X X X X
راح عيد تسجيل رقم موبايلي,X X X X X
بغيت اغدي لقائمة تغيير البيانات,X X X X X
عايزة اعرف الاوردر فاضله اد ايه,X X X X X X
عايزة ابدل رقم التليفون,X X X X
اريد الاطلاع على المنيو من فضلك,X X X X X X
ممكن توريني الطلبات المفضلة,X X X X
فيك تنتقل للخطوة اللاحقة,X X X X
2 فول واحد وسط و واحد كبير,itemnumber ItemName X ItemSize X X X
فيك تزودني بالحساب,X X X
عايزة احدث البيانات من فضلك,X X X X X
بدي الأكل يلي طلبتوا من قبل,X X X X X X
ارغب في اضافة عنواني,X X X X
ليه التاخير دا كله,X X X X
ابي عدل عنواني يا خيي,X X X X X
عايزة استبعد العنوان ده,X X X X
عايز اشوف الأكل المفضل,X X X X
ابي الشيك من فضلك,X X X X
كنت عايزة اضيف عنوان بيتي,X X X X X
ممكن تعرضلي قائمة الطعام,X X X X
فيني انتقل لقائمة السندوتشات,X X X MenuName
عاوز اشوف الاوردر المفضل,X X X X
الاوردر ما وصل الى الحين,X X X X X
وش سوي الحين,X X X
حساب الاكل كام,X X X
عاوز اشوف الاوردرات السابقة,X X X X
غدينى على كيفك,X X X
عايزة اضيف عنوان منزلي من فضلك,X X X X X X
عايز اعرف الاوردر رقم 98686 موصلش ليه اللى الان,X X X X OrderNumber X X X X
ممكن اعرف طريقة تسجيل العنوان,X X X X X
قولي ايه تاني,X X X
ممكن اشوف القائمة المفضلة,X X X X
زود 4 سمك فيليه بالفرن,X itemnumber ItemName ItemName ItemName
افتح القائمة الرئيسية,X X X
اذا ما عليك امر ابغى اغير رقم جوالي لهذا الرقم 01200011111,X X X X X X X X X X phone
بدي 2 بيبيروني بيتزا,X itemnumber ItemName MenuName
ممكد اأدد العنوان بتاعي,X X X X
عايز اشوف قائمة الطلبات,X X X X
اقدر اشوف الاوردر من الاول,X X X X X
انا عايزة الحساب,X X X
اذهب للمرحلة التالية,X X X
نقلب على القائمة الرئيسية,X X X X
داير على بالى القى نظره على الاوردرات المفضله,X X X X X X X X
شيل العنوان,X X
بعد اذنك هزود وجبة التوفير,X X X ItemName ItemName
بدي تابع الاوردر تبعي بليز 564652,X X X X X OrderNumber
رقم 5,X X
انا كتبت رقم قديم وعايز اعمل تحديث,X X X X X X X
ابي بدل رقم الجوال,X X X X
ازقرت,X
عايز 2 وجبة سموكي تشيز معاها مايونيز صوص,X itemnumber PredefinedMealName PredefinedMealName PredefinedMealName Include Topping_Include Topping_Include
بدي شوف المنيو مرة اخرى,X X X X X
عاوز اشوف الطلبات المفضلة,X X X X
عايز فطيرة مكس جبن,X ItemName ItemName ItemName
شكو ماكو,X X
ابغى ارجع للمنيو يا خيي,X X X X X
عندي عنوان جديد,X X X
بدياك تجاوبنى عن استفسارى,X X X X
فيني اذهب للمرحلة التالية,X X X X
افتح المنيو لو سمحت,X X X X
هاخد حجم كبير,X X ItemSize
بدي ضيف عنوان المنزل اذا بتريد,X X X X X X
عايزة اجرب 2 ساندوتش شاورما,X X itemnumber ItemName ItemName
بدي ثمان بيتزا بيبروني دون الماشروم بليز,X itemnumber ItemName ItemName Exclude Topping_Exclude Topping_Exclude
غيرت مكان المنزل ممكن تبدلى العنوان بالعنوان الجديد,X X X X X X X X
فرجيني الاكل يلي بطلبوا دايما,X X X X X
فيك تضيفلي وجبة الميجا ماك بليز,X X ItemName ItemName ItemName X
فيني انتقل للمرحلة الأخيرة,X X X X
امحي العنوان,X X
بونجور بوت,X X
عايز وجبتين دويتو,X itemnumber PredefinedMealName
داير اشوف الاشياء الي طلبتها,X X X X X
فيني احذف العنوان تبعي,X X X X
فيك تفرجيني منيو السلطات بستيك اوت,X X X X X X
فينا نراجع الاوردر اذا بتريد,X X X X X
3 اطباق حلقات بصل مقلية,itemnumber X ItemName ItemName ItemName
1 بيج ماك بيكون كومبو,itemnumber ItemName ItemName X ItemSize
عايز حسابي من فضلك,X X X X
كنت عايز اعدل عنواني,X X X X
ابغى اكل 3 ساندوتشات تشيز برجر اكسترا صوص,X X itemnumber ItemName ItemName ItemName Include Include
انا بدي غير رقم الموبايل,X X X X X
ما اجا للحين,X X X
ممكن اسألك عا شي,X X X X
لو سمحت عايزة اعرف اسجل بياناتي ازاي,X X X X X X X
ممكن تديني الشيك,X X X
بدي اختار الأول,X X X
طلب رقم 54151 هيوصل امتى,X X OrderNumber X X
الاوردر هستلمه امتى,X X X
ابي غير رقم الجوال,X X X X
بدي غير رقم سليلاري بليز,X X X X X
وصلني للقائمة الرئيسية من فضلك,X X X X X
تقدر تنقلني لخدمة العملاء,X X X X
بدي اعرف الطلب برقم 09340 حقى وين الحين,X X X X OrderNumber X X X
زين,X
عايزة ابدل عنوان بيتي,X X X X
ابي احذف وجبة التشيكن ستربس,X X ItemName ItemName ItemName
عايزة وجبتي المفضلة لو سمحت,X X X X X
بدون طماطم,Exclude Topping_Exclude
عايز اشوف الاوردر من جديد,X X X X X
فيني اخد الحساب,X X X
هالو,X
ابي تساعدني بهالهوشة,X X X
مقلية,X
كنت عايزة اشوف طلبي المفضل,X X X X X
ابا شوف الكارت حقي,X X X X
بدي غير رقم الهاتف,X X X X
ابي ارجع للقائمة السابقة,X X X X
عايزة انتهي من عملية الشراء,X X X X X
كنت عايزة اضيف عنوان منزلي,X X X X X
احضر لي طبق مكرونة مع الماشروم,X X ItemName ItemName Include Topping_Include
هستلم الطلب في قد ايه,X X X X X
خليني الغي وجبة التوفير,X X ItemName ItemName
فيك تعدل لي عنواني,X X X X
صار معي رقم تليفون جديد,X X X X X
عايز اشوف منيو الفطار فى سانتوس,X X X X X X
عطيني الطلبات المسجلة,X X X
عايز اطلب حاجة لو سمحت,X X X X X
ودى فى تشيكن برجر مع الصوص الابيض,X X ItemName ItemName Include Topping_Include Topping_Include
صارلي زمان ماني عارف اطلب الاوردر,X X X X X X
هلا والله اخوي,X X X
ابغى احذف عنوان البيت حقي,X X X X X
كنت عايزة اسجل عنوان منزلي,X X X X X
وش سوي بعد,X X X
و بعد كدا,X X X
منغير طماطم,Exclude Topping_Exclude
امسح وجبة البيج ماك,X ItemName ItemName ItemName
عاوز شوف قائمة المقبلات,X X X MenuName
داير غير رقم جوالي,X X X X
عايزة 2 جاردن سبيشيال,X itemnumber PredefinedMealName PredefinedMealName
راح استلمه بقديش وقت,X X X X
الوووو,X
عايزة ابدل عنواني,X X X
بلكي استفسر عن شي,X X X X
فرجيني السلطات,X MenuName
راح عطيكم عنواني,X X X
انا جوعان,X X
حجم وسط,X ItemSize
بدي خبركن بمحل اقامتي,X X X X
من فضلك عايز اشوف طلبى السابق برقم 0433,X X X X X X X OrderNumber
شحو رقمي الجديد,X X X
ودى فى مساعدتك للمراجعه الاوردر,X X X X X
ممكن الغي وجبة العائلة من فضلك,X X ItemName ItemName X X
بدلى العنوان اذا سمحت,X X X X
اعرضلي الكارت تبعي بليز,X X X X
عايز اسجل عنوان البيت,X X X X
زود وجبة روديو على الاوردر,X PredefinedMealName PredefinedMealName X X
ابغى اشوف تفصيل الطلب حقي,X X X X X
انا خلصت كل الطلبات,X X X X
شلونك,X
بدياها صغيرة اذا بتريد,X ItemSize X X
ابغى اشوف الأشياء الي طلبتها,X X X X X
لو سمحت اتابع الاوردر معاك,X X X X X
كنت عايز اشوف الاوردرات الي طلبتها قبل كدا,X X X X X X X X
فينى اغير رقم المحمول حقى,X X X X X
انا بدي اطلب 2 بيتزا بيبروني كبار,X X X itemnumber ItemName ItemName ItemSize
بدى اتطلع على قوائم الطعام فى الشارقه,X X X X X X X
احتاج الى تبديل لغة التواصل,X X X X X
بدي شوف الكارت تبعي اذا بتريد,X X X X X X
فيك تغير لي عنواني,X X X X
رقم 3,X X
ابغى شوف الطلبات السابقة حقي,X X X X X
من فضلك امسح وجبة البيج ماك,X X X ItemName ItemName ItemName
ابغى ابدل رقم هاتفى الخلوى بارقم 034804024,X X X X X X phone
جمحنتان,X
فيك تبعتلي رابط القائمة الرئيسية,X X X X X
نممحن لاار,X X
فيني اعرف كيف اطلب الاوردر,X X X X X
خلني اشوف الكارت حقي,X X X X
عايزة اسألك على حاجة,X X X X
مع بيبسي,Include Topping_Include
عايزة وجبة تشيكن كومبو لارج,X PredefinedMealName PredefinedMealName PredefinedMealName ItemSize
بدي شوف تفاصل الاوردر تبعي,X X X X X
بدي اتطلع عالمينيو,X X X
فرجيني الاوردرات يلي طلبتها من قبل,X X X X X X
امتى راح يوصل الاكل,X X X X
بدي حدث البيانات تبعي,X X X X
ابغى حبتين بيتزا خضروات سميكة,X itemnumber ItemName ItemName X
عايز اضيف عنواني عندكوا,X X X X
هستلم الاكل في خلال قد ايه,X X X X X X
ايش الان,X X
ترجملي الكلام ده بالعربي,X X X Language
سويلي اوردر بيتزا سوبر سوبريم ستافد كراست من غير بصل,X X X X ItemName ItemName ItemName Exclude Exclude Topping_Exclude
فيك تخبرني بالحساب اذا بتريد,X X X X X
عايز طبق خضار,X X ItemName
تابعلي الطلبات,X X
اطلبلي طبق بطاطس محمرة كبير,X ItemName ItemName ItemName ItemSize
بدى اسال على اشياء,X X X X
فيك تطلبلي مكرونة كبدة كبير,X X ItemName ItemName ItemSize
انا عايزة اشوف الاوردر من الاول,X X X X X X
بلكي اتحدث مع ممثل خدمة عملاء,X X X X X X
عايزة حجمه صغير من فضلك,X X ItemSize X X
عايزة اسأل سؤال,X X X
خليني اغير عنوان البيت المسجل,X X X X X
فيك تضيفلي وجبة الاوريجينال انجوس,X X ItemName ItemName ItemName
الحساب المطلوب كام لو سمحت,X X X X X
اقدر ازودكوا بعنوان جديد,X X X X
ممكن ادخل عنوان البيت,X X X X
عايز اسجل عنوان البيت لو سمحت,X X X X X X
عنواني الجديد,X X
سوف اقوم بالحديث باللغة الانجليزية,X X X X Language
اذا بدك تفرجيني الطلبات مرة اخرى,X X X X X X
بليز بدي غير رقم السيلولير,X X X X X
التالي,X
الاوردر صارلوا زمن ما بيوصل,X X X X X
بلكى اتحدث مع ممثل خدمه العمله,X X X X X X
فيني عدل العنوان,X X X
فيني استرجع الطلبات المسجلة,X X X X
بلكي تعطيني الحساب,X X X
لالالالالالالالاءللا,X
غير العنوان,X X
فراخ,ItemName
من فضلك عاوز اضيف عنوان البيت,X X X X X X
وريني منيو الفطار في ماك,X X X X X
من فضلك 3 شاورما ساندوتش و شيل التومية,X X itemnumber ItemName ItemName X Exclude Topping_Exclude
عطيني الفاتورة اذا بدك,X X X X
ابي الشيك يا اخي,X X X X
ممكن اسألك عا شي,X X X X
ايه الخطوة الي بعد كدا,X X X X X
عايز ادخل عنوان بيتي,X X X X
فيني روح عالقائمة الرئيسي,X X X X
نص سوا,X X
ةربنر يسبي,X X
عايز اشوف الاوردرات السابقة,X X X X
اقدر اشوف الاوردرات المفضلة بتاعتي,X X X X X
كنت عايزة اشوف طلبي المفضل,X X X X X
ابيه وسط,X ItemSize
اقدر اشوف السندوتشات في برجر كينج,X X X X X X
عايز احدث العنوان,X X X
ابي اتحدث باللغة العربية,X X X Language
بدي اكل 3 بيتزا بيبيروني وسط,X X itemnumber ItemName ItemName ItemSize
عايز منيو الاطباق الجانبية,X X MenuName MenuName
ابي صمونة دياي طوالية وسط,X ItemName ItemName ItemSize ItemSize
بدي شوف الاوردرات يلي طلبتها من قبل,X X X X X X X
شنو موجود بالسلطات,X X MenuName
بدي 2 سالاد اذا بتريد,X itemnumber ItemName X X
زودني بالمنيو الرئيسي,X X X
فيني استرجع الاوردرات القديمة بليز,X X X X X
حابب اغير رقم الهاتف الخاص بى للرقم 94934434,X X X X X X X phone
ابغى اسوي تغييرات بالبيانات حجي,X X X X X
بلكي اسأل عن شي,X X X X
ممكن تعرضلي المنيو,X X X
بلغني تمن الاوردر لو سمحت,X X X X X
كيف حالك,X X
بيج كينج ميل,ItemName ItemName ItemName
عطيني الكارت حجي,X X X
طلبي اتاخر,X X
لا تواخذني فيك تغير الرقم,X X X X X
2 بيتزا كبيرة ب 75 وتكون ستافت كرست,itemnumber ItemName ItemSize X X Include Topping_Include Topping_Include
عايز اتواصل مع حد من خدمة العملاء,X X X X X X X
فيك تساعدني بليز,X X X
عايزة حد من خدمة العملاء,X X X X X
ابغا نعرف الاوردرات السابقة,X X X X
خطواط تسجيل العنوان,X X X
امتى راح يجيني,X X X
عايز شوربة خضار,X ItemName ItemName
عايزة اغير اعنوان المسجل,X X X X
فيني حدث العنوان تبعي بليز,X X X X X
يمته بيوصل الأوردر,X X X
انا عايز اشوف قائمة الطعام,X X X X X
ممكن اشوف القائمة الرئيسية,X X X X
من فضلك تبدلي رقم موبايلي,X X X X X
عايزة ارسل عنوان البيت,X X X X
ممكن اتايع الطلبات وصلت لحد فين,X X X X X X
موافق,X
ليش الى حد الان ماوصل اوردرى المعنون برقم 3285,X X X X X X X X OrderNumber
منيح,X
ابغى شوف منيو السلطات,X X X X
عايزة اشوف الاكل الي طلبته قبل كدا,X X X X X X X
فيك تفرجيني شو بالمنيو اليوم,X X X X X
