text,label
عايز 10 كبده اسكندرانى كبير من غير بصل وفلفل وضيف طحينه,X itemnumber ItemName ItemName ItemSize Exclude Exclude Topping_Exclude Topping_Exclude Include Topping_Include
فيك توفرلى طريقه اتكلم بها مع اى شخص,X X X X X X X X
فيني اذهب لشي الخطوة التالية,X X X X X
هلأ فيني اتحدث مع ممثل خدمة عملا,X X X X X X X
ممكن زودكو بعنوان جديد,X X X X
محتاجة 3 ساندوشات شاورما وسط,X itemnumber ItemName ItemName ItemSize
ابغى راجع على الطلبات حقي,X X X X X
عايز 9 فلافل مخصوص من غير طماطم,X itemnumber ItemName ItemName Exclude Exclude Topping_Exclude
اقدر اغير لغة التواصل,X X X X
المفروض اعمل ايه دلوقتي,X X X X
فرجيني الشيك اذا بتريد,X X X X
عايز اتكلم مع شخص يفهم علي,X X X X X X
ابغى احدث العنوان حجي,X X X X
هغير عنواني,X X
فيك تغيرلي اللغة للانجلش,X X X Language
عايز اشوف طلباتي المسجلة,X X X X
ازاي بطلب اوردر,X X X
عندكوا مقبلات ايه,X MenuName X
ابقى اضيف رقم ارضي,X X X X
فيني انتقل لقائمة السندوتشات,X X X MenuName
خليني امسح الوجبة العائلية,X X ItemName ItemName
عايز ادخل وجبة تشيكن ماك,X X ItemName ItemName ItemName
بليز فيني الغي البيج تيستي ميل,X X X ItemName ItemName X
ودى شخص يحدثنى لو سمحت,X X X X X
وين الاوردر لحين,X X X
فيني شوف منيو الشوربة,X X X MenuName
ابا ابدل العنوان,X X X
عايزة منيو وجبات الاطفال ماكدونالدز,X X X X X
خليني شوف ايه الموجود اذا بتريد,X X X X X X
عايز الحساب دلوقتي لو سمحت,X X X X X
ممكن استبعد عنواني,X X X
افتحلي القائمة الرئيسية,X X X
ابي الحساب,X X
منفضلك عندى استفسارات,X X X
عايز اتكلم مع شخص حقيقي,X X X X X
راح اسأل سؤال,X X X
3 ساندوتشات فول,ItemName ItemName ItemName
ابغى اتحدث مع انسان,X X X X
فيني زود وجبة الجراند تشيكن اذا بتريد,X X ItemName ItemName ItemName X X
اهلين بوت,X X
حولني بخدمة العملا,X X X
عاوز اكتب عنوان البيت,X X X X
كنت عايزة اضيف عنوان البيت,X X X X X
عايز اعرف شوية حاجات من فضلك,X X X X X X
ممكن منيو المقطم من فضلك,X X X X X
بدي حاسب الحين,X X X
هاتلي الحساب من فضلك,X X X X
خليني شوف المنيو,X X X
عايز احول اللغة,X X X
عفاك تزودلي خبز,X Include Topping_Include
هل يمكنني التحدث مع خدمة العملاء,X X X X X X
عايز اشوف الاوردرز القديمة,X X X X
ابي صمونة لحم حجم كبير,X ItemName ItemName X ItemSize
ممكن توريني الأكل الموجود,X X X X
كم الفاتوره الخاصه بمشترياتى,X X X X
عاوز اطلب 3 ساندوتشات شاورمة فراخ وضيف تومية,X X itemnumber ItemName ItemName ItemName Include Topping_Include
ياريت توصلني بانسان اتكلم معاه,X X X X X
عايز فطيرة مكس جبن,X ItemName ItemName ItemName
ابي الغي التشيكن ستربس ميل,X X ItemName ItemName ItemName
ابا اعرف كيف اسوي الاوردر يا خيي,X X X X X X X
عايز اضيف محل الاقامة الجديد,X X X X X
اعرض لي قائمة الطعام المفضل بتاعي,X X X X X X
هاطلب 3 سوبر سوبريم بيتزا من غير هوت دوج,X itemnumber ItemName ItemName ItemName Exclude Exclude Topping_Exclude Topping_Exclude
الحي الذي اسكن به,X X X X
نراجع الاوردر من الاول,X X X X
يا مرحبا,X X
ابي اتحدث بالعربية,X X Language
عايز اغير رقم تليفوني,X X X X
علاش الاوردر ما اجى,X X X X
داير اطلب 3 تشيكن ستربس ميل,X X itemnumber PredefinedMealName PredefinedMealName PredefinedMealName
عاوز اشوف الاكل المفضل بتاعي,X X X X X
اصبح لدي عنوان جديد,X X X X
ابا غير رقم المحمول,X X X X
فيك تطلبلي الحجم الصغير,X X X ItemSize
احضرلي طبق مكرونة مع الصوص الابيض,X ItemName ItemName Include Topping_Include Topping_Include
عايزة ممثل خدمة عملاء تكلم معاه,X X X X X X
رؤلب فبيبيس,X X
بدي يسويها صغيرة,X X ItemSize
بدي شوف السلطات,X X MenuName
عاوز انتهي من عملية الشراء,X X X X X
امسحلي الرقم,X X
كنت عايز وجبة الدويتو,X X ItemName ItemName
الاوردر لسة ما وصلش,X X X X
خليني امسح عنوان بيتي,X X X X
سلطة كولسلو,ItemName ItemName
شحو رقمي الجديد 999663478552,X X X phone
عايز اسجل عنوان منزلي,X X X X
ازاي بطلب اوردر,X X X
اذا بتسمح ممكن تغيررقم الفون للرقم 01256398475,X X X X X X phone
فيني الغي عنوان المنزل,X X X X
عطلان بشي فيك تساعدني,X X X X
كيف يمكننى تغير الرقم القديم للرقم 98764324435,X X X X X X phone
ورينى الاوردر الى طلبته بالرقم 20147,X X X X X OrderNumber
ابغى اسجل عنوان الدوام لتوصيل الطلب,X X X X X X
رايد اعرف الطلبات رقم 50230 وصلت فين لحين,X X X X OrderNumber X X X
بدي اطلب 3 بيج ماك,X X itemnumber ItemName ItemName
بغيت اعدل رقم جوالي,X X X X
2 وجبة ميجا مع مايونيز صوص,ItemName PredefinedMealName PredefinedMealName Include Topping_Include Topping_Include
ممكن اغير رقم الهاتف الخلوى ل 01532690144,X X X X X X phone
زودني بالمنيو الرئيسي,X X X
بغيت اضيف رقم ثابت,X X X X
ازاي اطلب اوردر لو سمحت,X X X X X
ممكن احول اللغة,X X X
عايزة الوجبة العائلية,X ItemName ItemName
فيك ترسلي قائمة المنيو,X X X X
بدياك تطلعنى على الاوردر رقم 8896 لانه ماوصل للحين,X X X X X OrderNumber X X X
باقي وقت اد ايه,X X X X
عايزة اعدل رقم موبايلي,X X X X
فيك تساعدني لأطلب الاوردر,X X X X
بدي احذف العنوان تبعي,X X X X
زود صوص الماشروم,Include Topping_Include Topping_Include
خلبني اتحدث مع انسان,X X X X
هاخدها كبيرة,X ItemSize
صارلي زمان ناطرته هلأ,X X X X
بريد اتحد مع شخص يفهم على,X X X X X X
ابى ساندوتش هامبرقر جواته جبنه,X ItemName ItemName Include Topping_Include
بلغني بالمنيو لو سمحت,X X X X
ماذا الحين,X X
ممكن اتتيع الاوردر لو سمحت,X X X X X
اذا فيك تفرجيني الاوردر من جديد,X X X X X X
عايزة الغي عنوان البيت,X X X X
كنت عايز اغير رقم تليفوني,X X X X X
هل يمكنني الذهاب للمرحلة التالية,X X X X X
خليني اتكلم باللغة العربية,X X X Language
عايزة اعرف الاوردر بياخد وقت اد ايه,X X X X X X X
من فضلك دخل عنواني,X X X X
نقلب على القائمة الرئيسية,X X X X
متوسطة,ItemSize
2 وجبة توفير مع باكت فراخ ناجتس,itemnumber PredefinedMealName PredefinedMealName X ItemName ItemName ItemName
عاوز استبدل رقمي المسجل باخر جديد,X X X X X X
عايز اروح على القائمة الرئيسية,X X X X X
عايز اشوف الاوردر اللى عنوانه325,X X X X OrderNumber
ابغا كبسة حجم كبير,X ItemName X ItemSize
ابغى الحساب حقي,X X X
عندي طلب,X X
الاختيار الأول,X X
كوتن,X
خليني انتقل للقائمة الرئيسية,X X X X
طلبي له ساعة اتصل عليهم يقولون يبغالك نص ساعة زيادة,X X X X X X X X X X
عاوز الاختيار الثاني,Include X X
كنت حابب اغير لغة التواصل الى الانجليزية,X X X X X X Language
اعرضلي الحاجات الي طلبتها,X X X X
فيني الغي هاد الوجبة العائلية,X X X ItemName ItemName
ابي احط رقم جوال ثاني,X X X X X
ما حدا وصل لاهلأ,X X X X
محتاج اراجع على الاوردر,X X X X
بلكي تعطيني الاوردرات السابقة,X X X X
بدي اعرف شو الوجبات يلي موجودة بمطعم ستيك أوت,X X X X X X X X X
هاكتب عنواني,X X
عايز استفسر عن شيء,X X X X
ممكن ارجع للمنيو,X X X
قدم لي المنيو الاساسي,X X X X
كيفاش احذف رقم الموبايل,X X X X
خليني اسألك عا شي,X X X X
لماذا هناك تاخير,X X X
فيني ارجع للمنيو بليز,X X X X
اعرضلي المعجنات,X MenuName
عاوز افتح قائمة تغيير البيانات,X X X X X
الافيك عنواني الجديد,X X X
اكسترا,X
بدياك تفرجيني قائمة الطلبات السابقة,X X X X X
ابا اذهب للقائمة الرئيسية حياك,X X X X X
ممكن اغير عنواني,X X X
فيني اتتبع الطلبات,X X X
ودى اتفرج على منيو البيك,X X X X X
بدي شوف ايش عندكن من البيتزا,X X X X X MenuName
فيني اطلب 3 ساندوتشات برجر مع سلطة سيزر,X X itemnumber ItemName ItemName Include Topping_Include Topping_Include
عايزة اشوف الطلبات القديمة,X X X X
خليني اتكلم مع انسان,X X X X
عنواني لجديد,X X
اقدر اروح على القائمة الرئيسية,X X X X X
عايزة وجبة ماك راب لو سمحت,X ItemName ItemName ItemName X X
الحادي عشر,X X
القديم البيت تركت لانو البيت عنوان غير بدي,X X X X X X X X
ابيها متوسطة,X ItemSize
لساتو ما وصل الاوردر,X X X X
سويلي اوردر بيتزا سوبر سوبريم ستافد كراست من غير بصل,X X ItemName ItemName ItemName X X Exclude Exclude Topping_Exclude
صغفف,X
عايزة اشوف الطلبات السابقة,X X X X
بطاطس محمرة,ItemName ItemName
من فضلك معاد الاوردر فاضلوا قد ايه,X X X X X X X
قائمة الطعام من فضلك,X X X X
معلش ممكن تضيفلي الرقم 4544545455,X X X X phone
فيك تعدل عنوان البيت تبعي,X X X X X
كان بدي الهابي ميل,X X ItemName ItemName
وين الاوردر متاعي,X X X
فرجيني قائمة الطعام اذا بتريد,X X X X X
بلكى تخبونى بمحتويات الاوردر السابق,X X X X X
الحساب عمل كام,X X X
كيف بسجل بياناتي,X X X
فيني حدد عنوان البيت,X X X X
ما اجا للحين,X X X
يمته بيوصل الأكل,X X X
عايز اعرف الاكل بياخد وقت اد ايه,X X X X X X X
لقد استبدلت رقم هاتفي,X X X X
تحديد اللغة العربية,X X Language
خليني الغي العنوان تبعي,X X X X
السلام عليكم,X X
بغيت الفاتورة,X X
لدي عنوان اخر,X X X
كنت عايزه الحجم الوسط,X X X ItemSize
عايزة 3 بيبيروني بيتزا,X itemnumber ItemName MenuName
ممكن تساعدني اطلب الاوردر,X X X X
اريد متابعة الطلبات,X X X
عايز اشوف الكارت بتاعي لو سمحت,X X X X X X
الحساب كدا كام,X X X
توحشتك بزاف,X X
اطلبلي 2 تشيكن برجر و زود الصوص,X itemnumber ItemName ItemName X Include Topping_Include
احضر لي الفاتورة,X X X
راح ادخل رقمي الخاص الجديد,X X X X X
عايز اشوف المنيو الأساسي,X X X X
ازاى بقدر اتحدث مع بنى ادم,X X X X X X
هدى رقم الموبايل,X X X
عايز اسجل عنوان منزلي,X X X X
ممكن اشوف قائمة الطعام,X X X X
ابى التطلع على اوردر عنوانه85475,X X X X OrderNumber
بدي حدا من خدمة العملاء بليز,X X X X X X
كنت عايز الحجم كبير,X X X ItemSize
خليني اتكلم مع انسان,X X X X
ابا شوف شو الأكل الي موجود,X X X X X X
الاوردر ما اجا,X X X
هذا هو رقم الهاتف الخلوى الجديد حقى 01548756258,X X X X X X X phone
بدي طبق فرايز مع بيبسي,X ItemName ItemName Include Topping_Include
عاوز اشوف الاوردر المعتاد,X X X X
حابب اشوف قوائم الاكل فى مدينه مراكش,X X X X X X X
فيني اطلع بالكارت,X X X
ما عم يظبط معي الأوردر,X X X X X
ابغى اضيف رقم ثاني لان الجوال المسجل عندكم مغلق حاليا,X X X X X X X X X X
ورينى اخر اوردر طلبته,X X X X
الاكل هستلمه امتى,X X X
بدياك تورينى منيوهات الاطفال فى ماكدونالدز,X X X X X X
خليني اشيل وجبة الميجا,X X ItemName ItemName
هختار الرابعة,Include Topping_Include
بليز فيك تغيرلي ارقامي المسجلة عندكون,X X X X X X
عايز اضيف عنوان الشغل لتوصيل الطلب,X X X X X X
اطلبلي 3 سلطة,X itemnumber ItemName
قيك تسويلي وجبة السوبر ستار من دون طماطم,X X PredefinedMealName PredefinedMealName PredefinedMealName Exclude Exclude Topping_Exclude
ممكن الحجم الكبير,X X ItemSize
شو الخطوة يلي جاية,X X X X
بدي اطلب 3 بيج ماك و 2 بيتزا,X X itemnumber ItemSize ItemName X X X
عايز اتابع الأكل,X X X
صار فيك تتابعلي الاوردر,X X X X
فاضل قد ايه عالأوردر,X X X X
وريني الاوردر مرة اخرى,X X X X
لوين صار الاوردر,X X X
مرحبا بك,X X
عايزة اشوف الاوردرات المتسجلة,X X X X
هاطلب باستا فراخ كرسبي مع الجبنة السائحة,X ItemName ItemName ItemName Include Topping_Include Topping_Include
فيك تحذف عنواني المسجل بليز,X X X X X
فيني انتقل للخطوة الأخيرة,X X X X
شطل,X
بيكفي هيك بدي الحساب,X X X X
ريسبيسبق خنللاسي,X X
كنت عايزة اطلب جراند تشيكن ساندوتش مع صوص الجبنة,X X X ItemName ItemName ItemName Include Topping_Include Topping_Include
خليني بلش اتحدث مع خدمة عملاء بليز,X X X X X X X
اريد مسح العنوان المسجل و اضافة اخر,X X X X X X X
اعرضلي منيو الفكة في ماكدونالدز,X X X X X
احذفلي الوجبة العائلية,X ItemName ItemName
زود 3 اوريجينال انجوس منغير طماطم لو سمحت,X itemnumber ItemName ItemName Exclude Topping_Exclude X X
فيني اخذ الفاتورة حجي,X X X X
عايزة اشوف اوردراتي المتسجلة,X X X X
بدي اطلب 2 بيتزا بيبروني كبار معهم كاتشب بليز,X X itemnumber ItemName ItemName ItemSize Include Topping_Include X
فيني راجع الاوردر اذا بتريد,X X X X X
ممكن تطلبي وجبة الليتل تيستي,X X ItemName ItemName ItemName
اذا بدك تجهزلي الفاتورة,X X X X
كيف اقوم بادخال العنوان,X X X X
حكيني بالعربية,X Language
داير ضيف وجبة كوارتر باوندر,X X ItemName ItemName ItemName
خضار سوتيه,ItemName ItemName
كيفاش عدل رقم الموبايل تبعي,X X X X X
ابا عدل العنوان,X X X
ابغا اتطلع على اوردرى السابق المعنون ب 83398,X X X X X X X OrderNumber
وريني ايه الي موجود النهاردة,X X X X X
احتاج الى تبديل اللغة,X X X X
محتاجة اشوف الكارت,X X X
مع بيبسي,Include Topping_Include
عايز احدد محل الاقامة من فضلك,X X X X X X
كنت عايز اشوف طلبي المفضل,X X X X X
كنت عايزة اسجل عنوان البيت,X X X X X
انا بدي غير اللغة,X X X X
ودى استفسر عن شئ,X X X X
فيني احاكيك باللغة العربية,X X X Language
كفتة,X
عايز تبعتلي ملخص الاوردر بتاعي لو تسمح,X X X X X X X
بدي 3 فرايز حجم كبير بليز,X itemnumber ItemName X ItemSize X
اريد ان اطلع على الاوردرات السابقة,X X X X X X
ممكن احذف عنواني,X X X
ياليت ترسللي القائمة الرئيسية,X X X X
عاوز اعرف الاوردر بيوصل في قد ايه,X X X X X X X
محتاج اسأل عن حاجة,X X X X
ممكن تعدلى رقم الفون بتاعى للرقم 998658340,X X X X X X phone
هياخد قد ايه,X X X
عايز الشيك من فضلك,X X X X
ابي صامونة دياي دوارية سوهالي كت,X ItemName ItemName ItemSize X X
ابغى اشوف الأوردر,X X X
ليش غاب الاوردر 50041 كتير,X X X OrderNumber X
الحي يلي بسكن فيه,X X X X
كيفك ممكن تساعدنى,X X X
عايزة ازود وجبة ليتل تيستي,X X ItemName ItemName ItemName
واشراك,X
خدلي الاوردر ده 3 بيتزا بيبروني مع باكت فرايز كبير,X X X itemnumber ItemName ItemName Include Topping_Include Topping_Include ItemSize
زودلي وجبة التوفير لو سمحت,X ItemName ItemName X X
امسحلي وجبة الميجا ماك,X ItemName ItemName ItemName
ماتحول لى اللغه الى اللغه الانجليزيه,X X X X X Language
وريني المنيو,X X
اتمنى منك تفرجينى مكان الاوردر بتاعى,X X X X X X
ممكن اتواصل معاكم برقم اخر,X X X X X
ابغا نتفرج على الاوردر وينو تويكا,X X X X X X
عاوز اتواصل مع انسان,X X X X
كان بدي الهابي ميل,X X ItemName ItemName
عايزة اتنين سموكي تشيز,X itemnumber PredefinedMealName PredefinedMealName
وريني الطلبات القديمة,X X X
ممكن اختار رقم 2,X X X X
زود 3 اوريجينال انجوس منغير طماطم لو سمحت,X itemnumber ItemName ItemName Exclude Topping_Exclude X X
ابغى اطلب طبق سيفود,X X ItemName ItemName
فيك تفرجيني الكارت,X X X
حجم صغير,X ItemSize
خليني اشرحلك المشكلة,X X X
ممكن توريني المنيو,X X X
بدي شوف منيو السلطات بماكدونالدز بليز,X X X X X X
وجبة ماك راب منغير طماطم,PredefinedMealName PredefinedMealName PredefinedMealName Exclude Topping_Exclude
ممكن تبعتلي الحساب عالرقم ده 01157899634,X X X X X phone
كنت عايزة اعمل تعديل في العنوان,X X X X X X
01547869351 هذا الرقم الجديد حقى غيره مكان الرقم القديم من فضلك,phone X X X X X X X X X X
عايز بطاطس مش خضار,Include Topping_Include Exclude Topping_Exclude
ازيك,X
بدياك تساعدني يا خيي,X X X X
عايز اضيف العنوان الجديد,X X X X
ابى شوف الطلبات يلي طلبتها من جبل,X X X X X X X
محتاج ساندويتش زنجر من غير كاتشب,X ItemName ItemName Exclude Exclude Topping_Exclude
عايز احذف عنواني لو سمحت,X X X X X
عايزة اشيل عنوان البيت بتاعي,X X X X X
فيك تفرجيني قائمة الطعام,X X X X
فيك تبعتلي منيو المشروبات في اريجاتو,X X X X X X
هاكتب عنواني,X X
اعرضلي اكلي المفضل,X X X
غير لي العنوان المسجل,X X X X
كدايرة,X
ممكن احط العنوان بتاعي,X X X X
بليز ازا فيك تغيرلي عنواني المسجل عندك,X X X X X X X
اديهالي حجم وسط,X X ItemSize
وشنو كاين الاوردر,X X X
بدياك تفرجيني اوردري المفضل,X X X X
سويلي هاي الاوردر بليز 2 بيتزا مارجريتا مع بيبسي,X X X X ItemSize ItemName ItemName Include Topping_Include
ابا غير رقم الهاتف,X X X X
ممكن اضيف عنوان بيتي,X X X X
شكون بدو يساعدني,X X X
ممكن اتساعدني,X X
اذا بتريد تزودلي بروكلي مشوي عليه جبنة,X X X ItemName ItemName Include Topping_Include
فيك تغير لي عنوان البيت,X X X X X
فرجيني طعامي المفضل,X X X
عايز اراجع الطلبات,X X X
ممكن خطواط اضافة العنوان,X X X X
ابغي واحدة تشيكن سوبريم بيتزا بغير الفلفل,X itemnumber ItemName ItemName ItemName Exclude Topping_Exclude
السوبر ستار ميل لو سمحت,PredefinedMealName PredefinedMealName PredefinedMealName X X
هاطلب وجبة التشيكن ستربس,X itemnumber ItemName ItemName
اذا فيك تطلعنى على طلب854355,X X X X OrderNumber
عايزة احدث البيانات,X X X
عطيني القائمة المفضلة,X X X
شوفلي الاوردر فاضله قد ايه,X X X X X
هيك بيكون العنوان,X X X
منيح,X
مع السلامة,X X
عايز اشوف المقبلات الي في المنيو من فضلك,X X MenuName X X X X X
سوف اقوم بتبديل رقم المحمول,X X X X X
من فضلك عايز اغير الرقم,X X X X X
ابعتلي كله من الأول,X X X X
ممكن نراجع الاوردر بقى,X X X X
ابي واحد برياني الفراخ,X itemnumber ItemName ItemName
بدي شوف الكارت تبعي,X X X X
الأكل هييجي في قد ايه,X X X X X
هاكا,X
ممكن اشوف الحاجات الي طلبتها,X X X X X
عايز حجمها كبير من فضلك,X X ItemSize X X
2 فول اسكندراني,itemnumber ItemName ItemName
انتقل الى المنيو الرئيسي,X X X X
ابي حدث رقم الجوال,X X X X
صار فيك تتابع الاوردر,X X X X
ايه الي موجود في قائمة الطعام,X X X X X X
فاضله قد ايه,X X X
زودني بالطلبات السابقة,X X X
ابى اشوف الاوردر الفائت بعنوان5845,X X X X OrderNumber
فرايز,ItemName
راح اخذ الحجم الكبير,X X X ItemSize
فيني غير عنوان منزلي,X X X X
شفيتش,X
فيك تساعدني تأطلب الاوردر بليز,X X X X X
حابب اعدل رقم هاتفى للرقم 93595935 بدل الرقم القديم المحفوظ عندكم,X X X X X phone X X X X X
ابا بدل رقم الجوال,X X X X
راخ اخد فراخ مشوية مع طبق ارز كبير,X X ItemName ItemName Include Topping_Include Topping_Include ItemSize
ممكن منيو السلطات بماك,X X X X
حضروا لي طبق سلطة خضرا صغير بدون بصل,X X X ItemName ItemName ItemSize Exclude Topping_Exclude
ابا بدل رقم جوالي,X X X X
عايزة الأكل المسجل,X X X
شو الاكل يلي عندكن,X X X X
هلا هلا,X X
عايز اجرب ال تشيز برجر مع اكسترا صوص,X X X ItemName ItemName Include X Topping_Include
عايز الغي عنواني لو سمحت,X X X X X
النهارده كام فى الشهر,X X X X
مرة سبايسي,X X
بغيت اتكلم مع بنادم,X X X X
اخوي ابي استفتسر عن شي ممكن,X X X X X X
وشنهى الطلب رقم 984430 ماوصل الى الان,X X X OrderNumber X X X
من فضلك ورينى الطلبات اللى قبل كدا,X X X X X X X
راح اطلب طبق سلطة كبير,X X ItemName ItemName ItemName
زيادة,X
عايزة الاوردرات المسجلة,X X X
حدثلى رقم جوالى للرقم 201524857,X X X X phone
بتقدر توصلنى مع ممثل خدمه العملاء,X X X X X X
عايزة احدث عنواني,X X X
رقم 9,X X
فيك تراجع الطلبات بليز,X X X X
كان بدي الغي العنوان,X X X X
هياخد وقت قد ايه,X X X X
داير تساعدني,X X
اختار اللغة العربية,X X Language
خاطر على بالى القى نظره على منيوهات المطاعم فى العين,X X X X X X X X X X
فيني زود وجبة الجراند تشيكن اذا بتريد,X X ItemName ItemName ItemName X X
فيني تابع الاوردر حجي,X X X X
ابغا 4 وجبات كله بيج ماك,X itemnumber X X ItemName ItemName
اريد الذهاب للمرحلة التالية,X X X X
هاخد 2 بيبروني بيتزا كبير مع تشيلي صوص,X itemnumber ItemName ItemName ItemSize Include Topping_Include Topping_Include
صرت بدي اذهب للقائمة الرئيسية,X X X X X
خليني شوف ايه الموجود اذا بتريد,X X X X X X
ابي غير رقم الجوال تبعي,X X X X X
اذا فيك تغيرلي رقمي,X X X X
ودى فى بعض القوائم للمطاعم فى السعوديه,X X X X X X X
ممكن تخليلي الرقم دا 0125968684 هو رقمى الجديد مكان القديم,X X X X phone X X X X X
ابى بيج ماك من غير طماطم,X ItemName ItemName Exclude Exclude Topping_Exclude
ابغى ارجع للمنيو الرئيسي,X X X X
عايزة اضيف العنوان الجديد,X X X X
